No.     Time           Source                Destination           Protocol Length Info
      1 0.000000000    10.20.152.103         239.255.255.250       SSDP     175    M-SEARCH * HTTP/1.1 

Frame 1: 175 bytes on wire (1400 bits), 175 bytes captured (1400 bits) on interface 0
Ethernet II, Src: ChiconyE_42:9d:88 (64:5a:04:42:9d:88), Dst: IPv4mcast_7f:ff:fa (01:00:5e:7f:ff:fa)
Internet Protocol Version 4, Src: 10.20.152.103 (10.20.152.103), Dst: 239.255.255.250 (239.255.255.250)
User Datagram Protocol, Src Port: 53911 (53911), Dst Port: 1900 (1900)
Hypertext Transfer Protocol

No.     Time           Source                Destination           Protocol Length Info
      2 0.716710000    10.20.155.179         10.20.155.255         BJNP     58     Scanner Command: Discover

Frame 2: 58 bytes on wire (464 bits), 58 bytes captured (464 bits) on interface 0
Ethernet II, Src: Apple_98:8d:12 (d8:a2:5e:98:8d:12), Dst: Broadcast (ff:ff:ff:ff:ff:ff)
Internet Protocol Version 4, Src: 10.20.155.179 (10.20.155.179), Dst: 10.20.155.255 (10.20.155.255)
User Datagram Protocol, Src Port: 55022 (55022), Dst Port: 8612 (8612)
Canon BJNP, Scanner Command: Discover

No.     Time           Source                Destination           Protocol Length Info
      3 0.716856000    10.20.155.179         224.0.0.1             BJNP     58     Printer Command: Unknown code (2)

Frame 3: 58 bytes on wire (464 bits), 58 bytes captured (464 bits) on interface 0
Ethernet II, Src: Apple_98:8d:12 (d8:a2:5e:98:8d:12), Dst: IPv4mcast_01 (01:00:5e:00:00:01)
Internet Protocol Version 4, Src: 10.20.155.179 (10.20.155.179), Dst: 224.0.0.1 (224.0.0.1)
User Datagram Protocol, Src Port: 53300 (53300), Dst Port: 8612 (8612)
Canon BJNP, Printer Command: Unknown code (2)

No.     Time           Source                Destination           Protocol Length Info
      4 1.126442000    10.20.153.95          224.0.0.251           MDNS     82     Standard query 0x0000  PTR _googlecast._tcp.local, "QM" question

Frame 4: 82 bytes on wire (656 bits), 82 bytes captured (656 bits) on interface 0
Ethernet II, Src: MurataMa_eb:c5:62 (10:a5:d0:eb:c5:62), Dst: IPv4mcast_fb (01:00:5e:00:00:fb)
Internet Protocol Version 4, Src: 10.20.153.95 (10.20.153.95), Dst: 224.0.0.251 (224.0.0.251)
User Datagram Protocol, Src Port: 5353 (5353), Dst Port: 5353 (5353)
Domain Name System (query)

No.     Time           Source                Destination           Protocol Length Info
      5 1.228849000    10.20.153.255         224.0.0.251           MDNS     82     Standard query 0x0000  PTR _googlecast._tcp.local, "QM" question

Frame 5: 82 bytes on wire (656 bits), 82 bytes captured (656 bits) on interface 0
Ethernet II, Src: Htc_8d:e1:1d (e8:99:c4:8d:e1:1d), Dst: IPv4mcast_fb (01:00:5e:00:00:fb)
Internet Protocol Version 4, Src: 10.20.153.255 (10.20.153.255), Dst: 224.0.0.251 (224.0.0.251)
User Datagram Protocol, Src Port: 5353 (5353), Dst Port: 5353 (5353)
Domain Name System (query)

No.     Time           Source                Destination           Protocol Length Info
      6 1.413761000    10.20.152.255         205.213.114.30        TCP      1514   [TCP segment of a reassembled PDU]

Frame 6: 1514 bytes on wire (12112 bits), 1514 bytes captured (12112 bits) on interface 0
Ethernet II, Src: Apple_b1:35:47 (70:56:81:b1:35:47), Dst: JuniperN_83:9f:f0 (88:e0:f3:83:9f:f0)
Internet Protocol Version 4, Src: 10.20.152.255 (10.20.152.255), Dst: 205.213.114.30 (205.213.114.30)
Transmission Control Protocol, Src Port: 59974 (59974), Dst Port: 443 (443), Seq: 1, Ack: 1, Len: 1448
    Source Port: 59974 (59974)
    Destination Port: 443 (443)
    [Stream index: 0]
    [TCP Segment Len: 1448]
    Sequence number: 1    (relative sequence number)
    [Next sequence number: 1449    (relative sequence number)]
    Acknowledgment number: 1    (relative ack number)
    Header Length: 32 bytes
    .... 0000 0001 0000 = Flags: 0x010 (ACK)
    Window size value: 4096
    [Calculated window size: 4096]
    [Window size scaling factor: -1 (unknown)]
    Checksum: 0xb793 [validation disabled]
    Urgent pointer: 0
    Options: (12 bytes), No-Operation (NOP), No-Operation (NOP), Timestamps
    [SEQ/ACK analysis]
    TCP segment data (1448 bytes)

No.     Time           Source                Destination           Protocol Length Info
      7 1.413762000    10.20.152.255         205.213.114.30        TLSv1.2  815    Application Data

Frame 7: 815 bytes on wire (6520 bits), 815 bytes captured (6520 bits) on interface 0
Ethernet II, Src: Apple_b1:35:47 (70:56:81:b1:35:47), Dst: JuniperN_83:9f:f0 (88:e0:f3:83:9f:f0)
Internet Protocol Version 4, Src: 10.20.152.255 (10.20.152.255), Dst: 205.213.114.30 (205.213.114.30)
Transmission Control Protocol, Src Port: 59974 (59974), Dst Port: 443 (443), Seq: 1449, Ack: 1, Len: 749
    Source Port: 59974 (59974)
    Destination Port: 443 (443)
    [Stream index: 0]
    [TCP Segment Len: 749]
    Sequence number: 1449    (relative sequence number)
    [Next sequence number: 2198    (relative sequence number)]
    Acknowledgment number: 1    (relative ack number)
    Header Length: 32 bytes
    .... 0000 0001 1000 = Flags: 0x018 (PSH, ACK)
    Window size value: 4096
    [Calculated window size: 4096]
    [Window size scaling factor: -1 (unknown)]
    Checksum: 0x1f43 [validation disabled]
    Urgent pointer: 0
    Options: (12 bytes), No-Operation (NOP), No-Operation (NOP), Timestamps
    [SEQ/ACK analysis]
    TCP segment data (749 bytes)
[2 Reassembled TCP Segments (2197 bytes): #6(1448), #7(749)]
Secure Sockets Layer

No.     Time           Source                Destination           Protocol Length Info
      8 1.418002000    205.213.114.30        10.20.152.255         TCP      66     443→59974 [ACK] Seq=1 Ack=1449 Win=891 Len=0 TSval=661413964 TSecr=1132061058

Frame 8: 66 bytes on wire (528 bits), 66 bytes captured (528 bits) on interface 0
Ethernet II, Src: JuniperN_83:9f:f0 (88:e0:f3:83:9f:f0), Dst: Apple_b1:35:47 (70:56:81:b1:35:47)
Internet Protocol Version 4, Src: 205.213.114.30 (205.213.114.30), Dst: 10.20.152.255 (10.20.152.255)
Transmission Control Protocol, Src Port: 443 (443), Dst Port: 59974 (59974), Seq: 1, Ack: 1449, Len: 0
    Source Port: 443 (443)
    Destination Port: 59974 (59974)
    [Stream index: 0]
    [TCP Segment Len: 0]
    Sequence number: 1    (relative sequence number)
    Acknowledgment number: 1449    (relative ack number)
    Header Length: 32 bytes
    .... 0000 0001 0000 = Flags: 0x010 (ACK)
    Window size value: 891
    [Calculated window size: 891]
    [Window size scaling factor: -1 (unknown)]
    Checksum: 0x608c [validation disabled]
    Urgent pointer: 0
    Options: (12 bytes), No-Operation (NOP), No-Operation (NOP), Timestamps
    [SEQ/ACK analysis]

No.     Time           Source                Destination           Protocol Length Info
      9 1.418006000    205.213.114.30        10.20.152.255         TCP      66     443→59974 [ACK] Seq=1 Ack=2198 Win=914 Len=0 TSval=661413964 TSecr=1132061058

Frame 9: 66 bytes on wire (528 bits), 66 bytes captured (528 bits) on interface 0
Ethernet II, Src: JuniperN_83:9f:f0 (88:e0:f3:83:9f:f0), Dst: Apple_b1:35:47 (70:56:81:b1:35:47)
Internet Protocol Version 4, Src: 205.213.114.30 (205.213.114.30), Dst: 10.20.152.255 (10.20.152.255)
Transmission Control Protocol, Src Port: 443 (443), Dst Port: 59974 (59974), Seq: 1, Ack: 2198, Len: 0
    Source Port: 443 (443)
    Destination Port: 59974 (59974)
    [Stream index: 0]
    [TCP Segment Len: 0]
    Sequence number: 1    (relative sequence number)
    Acknowledgment number: 2198    (relative ack number)
    Header Length: 32 bytes
    .... 0000 0001 0000 = Flags: 0x010 (ACK)
    Window size value: 914
    [Calculated window size: 914]
    [Window size scaling factor: -1 (unknown)]
    Checksum: 0x5d88 [validation disabled]
    Urgent pointer: 0
    Options: (12 bytes), No-Operation (NOP), No-Operation (NOP), Timestamps
    [SEQ/ACK analysis]

No.     Time           Source                Destination           Protocol Length Info
     10 1.433657000    205.213.114.30        10.20.152.255         TLSv1.2  273    Application Data, Application Data, Application Data

Frame 10: 273 bytes on wire (2184 bits), 273 bytes captured (2184 bits) on interface 0
Ethernet II, Src: JuniperN_83:9f:f0 (88:e0:f3:83:9f:f0), Dst: Apple_b1:35:47 (70:56:81:b1:35:47)
Internet Protocol Version 4, Src: 205.213.114.30 (205.213.114.30), Dst: 10.20.152.255 (10.20.152.255)
Transmission Control Protocol, Src Port: 443 (443), Dst Port: 59974 (59974), Seq: 1, Ack: 2198, Len: 207
    Source Port: 443 (443)
    Destination Port: 59974 (59974)
    [Stream index: 0]
    [TCP Segment Len: 207]
    Sequence number: 1    (relative sequence number)
    [Next sequence number: 208    (relative sequence number)]
    Acknowledgment number: 2198    (relative ack number)
    Header Length: 32 bytes
    .... 0000 0001 1000 = Flags: 0x018 (PSH, ACK)
    Window size value: 914
    [Calculated window size: 914]
    [Window size scaling factor: -1 (unknown)]
    Checksum: 0xd9f6 [validation disabled]
    Urgent pointer: 0
    Options: (12 bytes), No-Operation (NOP), No-Operation (NOP), Timestamps
    [SEQ/ACK analysis]
Secure Sockets Layer

No.     Time           Source                Destination           Protocol Length Info
     11 1.433731000    10.20.152.255         205.213.114.30        TCP      66     59974→443 [ACK] Seq=2198 Ack=208 Win=4089 Len=0 TSval=1132061076 TSecr=661413978

Frame 11: 66 bytes on wire (528 bits), 66 bytes captured (528 bits) on interface 0
Ethernet II, Src: Apple_b1:35:47 (70:56:81:b1:35:47), Dst: JuniperN_83:9f:f0 (88:e0:f3:83:9f:f0)
Internet Protocol Version 4, Src: 10.20.152.255 (10.20.152.255), Dst: 205.213.114.30 (205.213.114.30)
Transmission Control Protocol, Src Port: 59974 (59974), Dst Port: 443 (443), Seq: 2198, Ack: 208, Len: 0
    Source Port: 59974 (59974)
    Destination Port: 443 (443)
    [Stream index: 0]
    [TCP Segment Len: 0]
    Sequence number: 2198    (relative sequence number)
    Acknowledgment number: 208    (relative ack number)
    Header Length: 32 bytes
    .... 0000 0001 0000 = Flags: 0x010 (ACK)
    Window size value: 4089
    [Calculated window size: 4089]
    [Window size scaling factor: -1 (unknown)]
    Checksum: 0x5032 [validation disabled]
    Urgent pointer: 0
    Options: (12 bytes), No-Operation (NOP), No-Operation (NOP), Timestamps
    [SEQ/ACK analysis]

No.     Time           Source                Destination           Protocol Length Info
     12 1.434226000    10.20.152.255         205.213.114.30        TLSv1.2  135    Application Data

Frame 12: 135 bytes on wire (1080 bits), 135 bytes captured (1080 bits) on interface 0
Ethernet II, Src: Apple_b1:35:47 (70:56:81:b1:35:47), Dst: JuniperN_83:9f:f0 (88:e0:f3:83:9f:f0)
Internet Protocol Version 4, Src: 10.20.152.255 (10.20.152.255), Dst: 205.213.114.30 (205.213.114.30)
Transmission Control Protocol, Src Port: 59974 (59974), Dst Port: 443 (443), Seq: 2198, Ack: 208, Len: 69
    Source Port: 59974 (59974)
    Destination Port: 443 (443)
    [Stream index: 0]
    [TCP Segment Len: 69]
    Sequence number: 2198    (relative sequence number)
    [Next sequence number: 2267    (relative sequence number)]
    Acknowledgment number: 208    (relative ack number)
    Header Length: 32 bytes
    .... 0000 0001 1000 = Flags: 0x018 (PSH, ACK)
    Window size value: 4096
    [Calculated window size: 4096]
    [Window size scaling factor: -1 (unknown)]
    Checksum: 0xb83a [validation disabled]
    Urgent pointer: 0
    Options: (12 bytes), No-Operation (NOP), No-Operation (NOP), Timestamps
    [SEQ/ACK analysis]
Secure Sockets Layer

No.     Time           Source                Destination           Protocol Length Info
     13 1.476051000    205.213.114.30        10.20.152.255         TCP      66     443→59974 [ACK] Seq=208 Ack=2267 Win=914 Len=0 TSval=661414022 TSecr=1132061076

Frame 13: 66 bytes on wire (528 bits), 66 bytes captured (528 bits) on interface 0
Ethernet II, Src: JuniperN_83:9f:f0 (88:e0:f3:83:9f:f0), Dst: Apple_b1:35:47 (70:56:81:b1:35:47)
Internet Protocol Version 4, Src: 205.213.114.30 (205.213.114.30), Dst: 10.20.152.255 (10.20.152.255)
Transmission Control Protocol, Src Port: 443 (443), Dst Port: 59974 (59974), Seq: 208, Ack: 2267, Len: 0
    Source Port: 443 (443)
    Destination Port: 59974 (59974)
    [Stream index: 0]
    [TCP Segment Len: 0]
    Sequence number: 208    (relative sequence number)
    Acknowledgment number: 2267    (relative ack number)
    Header Length: 32 bytes
    .... 0000 0001 0000 = Flags: 0x010 (ACK)
    Window size value: 914
    [Calculated window size: 914]
    [Window size scaling factor: -1 (unknown)]
    Checksum: 0x5c28 [validation disabled]
    Urgent pointer: 0
    Options: (12 bytes), No-Operation (NOP), No-Operation (NOP), Timestamps
    [SEQ/ACK analysis]

No.     Time           Source                Destination           Protocol Length Info
     14 2.048045000    0.0.0.0               255.255.255.255       IPv4     82     any private encryption scheme (99)

Frame 14: 82 bytes on wire (656 bits), 82 bytes captured (656 bits) on interface 0
Ethernet II, Src: Apple_a4:e9:70 (0c:3e:9f:a4:e9:70), Dst: Broadcast (ff:ff:ff:ff:ff:ff)
Internet Protocol Version 4, Src: 0.0.0.0 (0.0.0.0), Dst: 255.255.255.255 (255.255.255.255)
Data (48 bytes)

0000  57 4c 41 4e 20 66 6f 72 77 61 72 64 69 6e 67 20   WLAN forwarding 
0010  75 70 64 61 74 65 20 66 72 6f 6d 20 41 50 20 30   update from AP 0
0020  30 3a 32 36 3a 33 65 3a 38 64 3a 37 39 3a 63 30   0:26:3e:8d:79:c0

No.     Time           Source                Destination           Protocol Length Info
     15 2.048053000    0.0.0.0               255.255.255.255       IPv4     82     any private encryption scheme (99)

Frame 15: 82 bytes on wire (656 bits), 82 bytes captured (656 bits) on interface 0
Ethernet II, Src: Apple_a4:e9:70 (0c:3e:9f:a4:e9:70), Dst: Broadcast (ff:ff:ff:ff:ff:ff)
Internet Protocol Version 4, Src: 0.0.0.0 (0.0.0.0), Dst: 255.255.255.255 (255.255.255.255)
Data (48 bytes)

0000  57 4c 41 4e 20 66 6f 72 77 61 72 64 69 6e 67 20   WLAN forwarding 
0010  75 70 64 61 74 65 20 66 72 6f 6d 20 41 50 20 30   update from AP 0
0020  30 3a 32 36 3a 33 65 3a 38 64 3a 37 39 3a 63 30   0:26:3e:8d:79:c0

No.     Time           Source                Destination           Protocol Length Info
     16 2.150453000    10.20.153.95          224.0.0.251           MDNS     82     Standard query 0x0000  PTR _googlecast._tcp.local, "QM" question

Frame 16: 82 bytes on wire (656 bits), 82 bytes captured (656 bits) on interface 0
Ethernet II, Src: MurataMa_eb:c5:62 (10:a5:d0:eb:c5:62), Dst: IPv4mcast_fb (01:00:5e:00:00:fb)
Internet Protocol Version 4, Src: 10.20.153.95 (10.20.153.95), Dst: 224.0.0.251 (224.0.0.251)
User Datagram Protocol, Src Port: 5353 (5353), Dst Port: 5353 (5353)
Domain Name System (query)

No.     Time           Source                Destination           Protocol Length Info
     17 2.253010000    0.0.0.0               255.255.255.255       DHCP     342    DHCP Request  - Transaction ID 0x18ccac7e

Frame 17: 342 bytes on wire (2736 bits), 342 bytes captured (2736 bits) on interface 0
Ethernet II, Src: Apple_a4:e9:70 (0c:3e:9f:a4:e9:70), Dst: Broadcast (ff:ff:ff:ff:ff:ff)
Internet Protocol Version 4, Src: 0.0.0.0 (0.0.0.0), Dst: 255.255.255.255 (255.255.255.255)
User Datagram Protocol, Src Port: 68 (68), Dst Port: 67 (67)
Bootstrap Protocol (Request)

No.     Time           Source                Destination           Protocol Length Info
     18 2.253015000    10.20.153.255         224.0.0.251           MDNS     82     Standard query 0x0000  PTR _googlecast._tcp.local, "QM" question

Frame 18: 82 bytes on wire (656 bits), 82 bytes captured (656 bits) on interface 0
Ethernet II, Src: Htc_8d:e1:1d (e8:99:c4:8d:e1:1d), Dst: IPv4mcast_fb (01:00:5e:00:00:fb)
Internet Protocol Version 4, Src: 10.20.153.255 (10.20.153.255), Dst: 224.0.0.251 (224.0.0.251)
User Datagram Protocol, Src Port: 5353 (5353), Dst Port: 5353 (5353)
Domain Name System (query)

No.     Time           Source                Destination           Protocol Length Info
     19 2.253128000    fe80::f1:2d8a:4fd4:695f ff02::2               ICMPv6   62     Router Solicitation

Frame 19: 62 bytes on wire (496 bits), 62 bytes captured (496 bits) on interface 0
Ethernet II, Src: Apple_a4:e9:70 (0c:3e:9f:a4:e9:70), Dst: IPv6mcast_02 (33:33:00:00:00:02)
Internet Protocol Version 6, Src: fe80::f1:2d8a:4fd4:695f (fe80::f1:2d8a:4fd4:695f), Dst: ff02::2 (ff02::2)
Internet Control Message Protocol v6

No.     Time           Source                Destination           Protocol Length Info
     20 2.778149000    10.20.152.255         72.21.91.29           TCP      66     59993→80 [FIN, ACK] Seq=1 Ack=1 Win=4096 Len=0 TSval=1132062416 TSecr=1557443793

Frame 20: 66 bytes on wire (528 bits), 66 bytes captured (528 bits) on interface 0
Ethernet II, Src: Apple_b1:35:47 (70:56:81:b1:35:47), Dst: JuniperN_83:9f:f0 (88:e0:f3:83:9f:f0)
Internet Protocol Version 4, Src: 10.20.152.255 (10.20.152.255), Dst: 72.21.91.29 (72.21.91.29)
Transmission Control Protocol, Src Port: 59993 (59993), Dst Port: 80 (80), Seq: 1, Ack: 1, Len: 0
    Source Port: 59993 (59993)
    Destination Port: 80 (80)
    [Stream index: 1]
    [TCP Segment Len: 0]
    Sequence number: 1    (relative sequence number)
    Acknowledgment number: 1    (relative ack number)
    Header Length: 32 bytes
    .... 0000 0001 0001 = Flags: 0x011 (FIN, ACK)
    Window size value: 4096
    [Calculated window size: 4096]
    [Window size scaling factor: -1 (unknown)]
    Checksum: 0x7b91 [validation disabled]
    Urgent pointer: 0
    Options: (12 bytes), No-Operation (NOP), No-Operation (NOP), Timestamps

No.     Time           Source                Destination           Protocol Length Info
     21 2.784576000    72.21.91.29           10.20.152.255         TCP      56     80→59993 [RST] Seq=1 Win=0 Len=0

Frame 21: 56 bytes on wire (448 bits), 56 bytes captured (448 bits) on interface 0
Ethernet II, Src: JuniperN_83:9f:f0 (88:e0:f3:83:9f:f0), Dst: Apple_b1:35:47 (70:56:81:b1:35:47)
Internet Protocol Version 4, Src: 72.21.91.29 (72.21.91.29), Dst: 10.20.152.255 (10.20.152.255)
Transmission Control Protocol, Src Port: 80 (80), Dst Port: 59993 (59993), Seq: 1, Len: 0
    Source Port: 80 (80)
    Destination Port: 59993 (59993)
    [Stream index: 1]
    [TCP Segment Len: 0]
    Sequence number: 1    (relative sequence number)
    Acknowledgment number: 0
    Header Length: 20 bytes
    .... 0000 0000 0100 = Flags: 0x004 (RST)
    Window size value: 0
    [Calculated window size: 0]
    [Window size scaling factor: -1 (unknown)]
    Checksum: 0x93bb [validation disabled]
    Urgent pointer: 0
VSS-Monitoring ethernet trailer, Source Port: 0

No.     Time           Source                Destination           Protocol Length Info
     22 2.969698000    fe80::f1:2d8a:4fd4:695f ff02::16              ICMPv6   130    Multicast Listener Report Message v2

Frame 22: 130 bytes on wire (1040 bits), 130 bytes captured (1040 bits) on interface 0
Ethernet II, Src: Apple_a4:e9:70 (0c:3e:9f:a4:e9:70), Dst: IPv6mcast_16 (33:33:00:00:00:16)
Internet Protocol Version 6, Src: fe80::f1:2d8a:4fd4:695f (fe80::f1:2d8a:4fd4:695f), Dst: ff02::16 (ff02::16)
Internet Control Message Protocol v6

No.     Time           Source                Destination           Protocol Length Info
     23 3.072085000    fe80::dc63:21d2:4f84:d00d ff02::1:3             LLMNR    95     Standard query 0xa8df  A BRW00809277646A

Frame 23: 95 bytes on wire (760 bits), 95 bytes captured (760 bits) on interface 0
Ethernet II, Src: GemtekTe_96:bf:8e (ac:81:12:96:bf:8e), Dst: IPv6mcast_01:00:03 (33:33:00:01:00:03)
Internet Protocol Version 6, Src: fe80::dc63:21d2:4f84:d00d (fe80::dc63:21d2:4f84:d00d), Dst: ff02::1:3 (ff02::1:3)
User Datagram Protocol, Src Port: 54259 (54259), Dst Port: 5355 (5355)
Link-local Multicast Name Resolution (query)

No.     Time           Source                Destination           Protocol Length Info
     24 3.072093000    10.20.154.203         224.0.0.252           LLMNR    75     Standard query 0xa8df  A BRW00809277646A

Frame 24: 75 bytes on wire (600 bits), 75 bytes captured (600 bits) on interface 0
Ethernet II, Src: GemtekTe_96:bf:8e (ac:81:12:96:bf:8e), Dst: IPv4mcast_fc (01:00:5e:00:00:fc)
Internet Protocol Version 4, Src: 10.20.154.203 (10.20.154.203), Dst: 224.0.0.252 (224.0.0.252)
User Datagram Protocol, Src Port: 52101 (52101), Dst Port: 5355 (5355)
Link-local Multicast Name Resolution (query)

No.     Time           Source                Destination           Protocol Length Info
     25 3.174491000    10.20.153.95          224.0.0.251           MDNS     82     Standard query 0x0000  PTR _googlecast._tcp.local, "QM" question

Frame 25: 82 bytes on wire (656 bits), 82 bytes captured (656 bits) on interface 0
Ethernet II, Src: MurataMa_eb:c5:62 (10:a5:d0:eb:c5:62), Dst: IPv4mcast_fb (01:00:5e:00:00:fb)
Internet Protocol Version 4, Src: 10.20.153.95 (10.20.153.95), Dst: 224.0.0.251 (224.0.0.251)
User Datagram Protocol, Src Port: 5353 (5353), Dst Port: 5353 (5353)
Domain Name System (query)

No.     Time           Source                Destination           Protocol Length Info
     26 3.174501000    fe80::dc63:21d2:4f84:d00d ff02::1:3             LLMNR    95     Standard query 0xa8df  A BRW00809277646A

Frame 26: 95 bytes on wire (760 bits), 95 bytes captured (760 bits) on interface 0
Ethernet II, Src: GemtekTe_96:bf:8e (ac:81:12:96:bf:8e), Dst: IPv6mcast_01:00:03 (33:33:00:01:00:03)
Internet Protocol Version 6, Src: fe80::dc63:21d2:4f84:d00d (fe80::dc63:21d2:4f84:d00d), Dst: ff02::1:3 (ff02::1:3)
User Datagram Protocol, Src Port: 54259 (54259), Dst Port: 5355 (5355)
Link-local Multicast Name Resolution (query)

No.     Time           Source                Destination           Protocol Length Info
     27 3.174662000    10.20.154.203         224.0.0.252           LLMNR    75     Standard query 0xa8df  A BRW00809277646A

Frame 27: 75 bytes on wire (600 bits), 75 bytes captured (600 bits) on interface 0
Ethernet II, Src: GemtekTe_96:bf:8e (ac:81:12:96:bf:8e), Dst: IPv4mcast_fc (01:00:5e:00:00:fc)
Internet Protocol Version 4, Src: 10.20.154.203 (10.20.154.203), Dst: 224.0.0.252 (224.0.0.252)
User Datagram Protocol, Src Port: 52101 (52101), Dst Port: 5355 (5355)
Link-local Multicast Name Resolution (query)

No.     Time           Source                Destination           Protocol Length Info
     28 3.276997000    10.20.153.255         224.0.0.251           MDNS     82     Standard query 0x0000  PTR _googlecast._tcp.local, "QM" question

Frame 28: 82 bytes on wire (656 bits), 82 bytes captured (656 bits) on interface 0
Ethernet II, Src: Htc_8d:e1:1d (e8:99:c4:8d:e1:1d), Dst: IPv4mcast_fb (01:00:5e:00:00:fb)
Internet Protocol Version 4, Src: 10.20.153.255 (10.20.153.255), Dst: 224.0.0.251 (224.0.0.251)
User Datagram Protocol, Src Port: 5353 (5353), Dst Port: 5353 (5353)
Domain Name System (query)

No.     Time           Source                Destination           Protocol Length Info
     29 3.277017000    Apple_a4:e9:70        Broadcast             ARP      56     Gratuitous ARP for 10.20.155.108 (Request)

Frame 29: 56 bytes on wire (448 bits), 56 bytes captured (448 bits) on interface 0
Ethernet II, Src: Apple_a4:e9:70 (0c:3e:9f:a4:e9:70), Dst: Broadcast (ff:ff:ff:ff:ff:ff)
Address Resolution Protocol (request/gratuitous ARP)

No.     Time           Source                Destination           Protocol Length Info
     30 3.277021000    Apple_a4:e9:70        Broadcast             ARP      56     Who has 10.20.152.1?  Tell 10.20.155.108

Frame 30: 56 bytes on wire (448 bits), 56 bytes captured (448 bits) on interface 0
Ethernet II, Src: Apple_a4:e9:70 (0c:3e:9f:a4:e9:70), Dst: Broadcast (ff:ff:ff:ff:ff:ff)
Address Resolution Protocol (request)

No.     Time           Source                Destination           Protocol Length Info
     31 3.277116000    Apple_a4:e9:70        Broadcast             ARP      56     Who has 169.254.255.255?  Tell 10.20.155.108

Frame 31: 56 bytes on wire (448 bits), 56 bytes captured (448 bits) on interface 0
Ethernet II, Src: Apple_a4:e9:70 (0c:3e:9f:a4:e9:70), Dst: Broadcast (ff:ff:ff:ff:ff:ff)
Address Resolution Protocol (request)

No.     Time           Source                Destination           Protocol Length Info
     32 3.379263000    ::                    ff02::1:ffd4:695f     ICMPv6   78     Neighbor Solicitation for fe80::f1:2d8a:4fd4:695f

Frame 32: 78 bytes on wire (624 bits), 78 bytes captured (624 bits) on interface 0
Ethernet II, Src: Apple_a4:e9:70 (0c:3e:9f:a4:e9:70), Dst: IPv6mcast_ff:d4:69:5f (33:33:ff:d4:69:5f)
Internet Protocol Version 6, Src: :: (::), Dst: ff02::1:ffd4:695f (ff02::1:ffd4:695f)
Internet Control Message Protocol v6

No.     Time           Source                Destination           Protocol Length Info
     33 3.379271000    10.20.154.203         10.20.155.255         NBNS     92     Name query NB BRW00809277646A<00>

Frame 33: 92 bytes on wire (736 bits), 92 bytes captured (736 bits) on interface 0
Ethernet II, Src: GemtekTe_96:bf:8e (ac:81:12:96:bf:8e), Dst: Broadcast (ff:ff:ff:ff:ff:ff)
Internet Protocol Version 4, Src: 10.20.154.203 (10.20.154.203), Dst: 10.20.155.255 (10.20.155.255)
User Datagram Protocol, Src Port: 137 (137), Dst Port: 137 (137)
NetBIOS Name Service

No.     Time           Source                Destination           Protocol Length Info
     34 3.686608000    fe80::2d63:551e:3d92:baaa ff02::1:2             DHCPv6   168    Solicit XID: 0xa90a36 CID: 000100011b853d62d4bed9686e9d 

Frame 34: 168 bytes on wire (1344 bits), 168 bytes captured (1344 bits) on interface 0
Ethernet II, Src: IntelCor_67:f3:4a (60:67:20:67:f3:4a), Dst: IPv6mcast_01:00:02 (33:33:00:01:00:02)
Internet Protocol Version 6, Src: fe80::2d63:551e:3d92:baaa (fe80::2d63:551e:3d92:baaa), Dst: ff02::1:2 (ff02::1:2)
User Datagram Protocol, Src Port: 546 (546), Dst Port: 547 (547)
DHCPv6

No.     Time           Source                Destination           Protocol Length Info
     35 3.686624000    Apple_a4:e9:70        Broadcast             ARP      56     Who has 169.254.255.255?  Tell 10.20.155.108

Frame 35: 56 bytes on wire (448 bits), 56 bytes captured (448 bits) on interface 0
Ethernet II, Src: Apple_a4:e9:70 (0c:3e:9f:a4:e9:70), Dst: Broadcast (ff:ff:ff:ff:ff:ff)
Address Resolution Protocol (request)

No.     Time           Source                Destination           Protocol Length Info
     36 3.694775000    10.20.152.255         205.213.114.13        TLSv1.2  1248   Application Data

Frame 36: 1248 bytes on wire (9984 bits), 1248 bytes captured (9984 bits) on interface 0
Ethernet II, Src: Apple_b1:35:47 (70:56:81:b1:35:47), Dst: JuniperN_83:9f:f0 (88:e0:f3:83:9f:f0)
Internet Protocol Version 4, Src: 10.20.152.255 (10.20.152.255), Dst: 205.213.114.13 (205.213.114.13)
Transmission Control Protocol, Src Port: 60002 (60002), Dst Port: 443 (443), Seq: 1, Ack: 1, Len: 1182
    Source Port: 60002 (60002)
    Destination Port: 443 (443)
    [Stream index: 2]
    [TCP Segment Len: 1182]
    Sequence number: 1    (relative sequence number)
    [Next sequence number: 1183    (relative sequence number)]
    Acknowledgment number: 1    (relative ack number)
    Header Length: 32 bytes
    .... 0000 0001 1000 = Flags: 0x018 (PSH, ACK)
    Window size value: 19005
    [Calculated window size: 19005]
    [Window size scaling factor: -1 (unknown)]
    Checksum: 0x80b1 [validation disabled]
    Urgent pointer: 0
    Options: (12 bytes), No-Operation (NOP), No-Operation (NOP), Timestamps
    [SEQ/ACK analysis]
Secure Sockets Layer

No.     Time           Source                Destination           Protocol Length Info
     37 3.704783000    205.213.114.13        10.20.152.255         TLSv1.2  643    Application Data

Frame 37: 643 bytes on wire (5144 bits), 643 bytes captured (5144 bits) on interface 0
Ethernet II, Src: JuniperN_83:9f:f0 (88:e0:f3:83:9f:f0), Dst: Apple_b1:35:47 (70:56:81:b1:35:47)
Internet Protocol Version 4, Src: 205.213.114.13 (205.213.114.13), Dst: 10.20.152.255 (10.20.152.255)
Transmission Control Protocol, Src Port: 443 (443), Dst Port: 60002 (60002), Seq: 1, Ack: 1183, Len: 577
    Source Port: 443 (443)
    Destination Port: 60002 (60002)
    [Stream index: 2]
    [TCP Segment Len: 577]
    Sequence number: 1    (relative sequence number)
    [Next sequence number: 578    (relative sequence number)]
    Acknowledgment number: 1183    (relative ack number)
    Header Length: 32 bytes
    .... 0000 0001 1000 = Flags: 0x018 (PSH, ACK)
    Window size value: 409
    [Calculated window size: 409]
    [Window size scaling factor: -1 (unknown)]
    Checksum: 0x79cc [validation disabled]
    Urgent pointer: 0
    Options: (12 bytes), No-Operation (NOP), No-Operation (NOP), Timestamps
    [SEQ/ACK analysis]
Secure Sockets Layer

No.     Time           Source                Destination           Protocol Length Info
     38 3.704794000    205.213.114.13        10.20.152.255         TCP      1514   [TCP segment of a reassembled PDU]

Frame 38: 1514 bytes on wire (12112 bits), 1514 bytes captured (12112 bits) on interface 0
Ethernet II, Src: JuniperN_83:9f:f0 (88:e0:f3:83:9f:f0), Dst: Apple_b1:35:47 (70:56:81:b1:35:47)
Internet Protocol Version 4, Src: 205.213.114.13 (205.213.114.13), Dst: 10.20.152.255 (10.20.152.255)
Transmission Control Protocol, Src Port: 443 (443), Dst Port: 60002 (60002), Seq: 578, Ack: 1183, Len: 1448
    Source Port: 443 (443)
    Destination Port: 60002 (60002)
    [Stream index: 2]
    [TCP Segment Len: 1448]
    Sequence number: 578    (relative sequence number)
    [Next sequence number: 2026    (relative sequence number)]
    Acknowledgment number: 1183    (relative ack number)
    Header Length: 32 bytes
    .... 0000 0001 0000 = Flags: 0x010 (ACK)
    Window size value: 409
    [Calculated window size: 409]
    [Window size scaling factor: -1 (unknown)]
    Checksum: 0x8a4a [validation disabled]
    Urgent pointer: 0
    Options: (12 bytes), No-Operation (NOP), No-Operation (NOP), Timestamps
    [SEQ/ACK analysis]
    TCP segment data (1448 bytes)

No.     Time           Source                Destination           Protocol Length Info
     39 3.704797000    205.213.114.13        10.20.152.255         TCP      1514   [TCP segment of a reassembled PDU]

Frame 39: 1514 bytes on wire (12112 bits), 1514 bytes captured (12112 bits) on interface 0
Ethernet II, Src: JuniperN_83:9f:f0 (88:e0:f3:83:9f:f0), Dst: Apple_b1:35:47 (70:56:81:b1:35:47)
Internet Protocol Version 4, Src: 205.213.114.13 (205.213.114.13), Dst: 10.20.152.255 (10.20.152.255)
Transmission Control Protocol, Src Port: 443 (443), Dst Port: 60002 (60002), Seq: 2026, Ack: 1183, Len: 1448
    Source Port: 443 (443)
    Destination Port: 60002 (60002)
    [Stream index: 2]
    [TCP Segment Len: 1448]
    Sequence number: 2026    (relative sequence number)
    [Next sequence number: 3474    (relative sequence number)]
    Acknowledgment number: 1183    (relative ack number)
    Header Length: 32 bytes
    .... 0000 0001 0000 = Flags: 0x010 (ACK)
    Window size value: 409
    [Calculated window size: 409]
    [Window size scaling factor: -1 (unknown)]
    Checksum: 0x9749 [validation disabled]
    Urgent pointer: 0
    Options: (12 bytes), No-Operation (NOP), No-Operation (NOP), Timestamps
    [SEQ/ACK analysis]
    [Reassembled PDU in frame: 54]
    TCP segment data (1448 bytes)

No.     Time           Source                Destination           Protocol Length Info
     40 3.704802000    205.213.114.13        10.20.152.255         TCP      1514   [TCP segment of a reassembled PDU]

Frame 40: 1514 bytes on wire (12112 bits), 1514 bytes captured (12112 bits) on interface 0
Ethernet II, Src: JuniperN_83:9f:f0 (88:e0:f3:83:9f:f0), Dst: Apple_b1:35:47 (70:56:81:b1:35:47)
Internet Protocol Version 4, Src: 205.213.114.13 (205.213.114.13), Dst: 10.20.152.255 (10.20.152.255)
Transmission Control Protocol, Src Port: 443 (443), Dst Port: 60002 (60002), Seq: 3474, Ack: 1183, Len: 1448
    Source Port: 443 (443)
    Destination Port: 60002 (60002)
    [Stream index: 2]
    [TCP Segment Len: 1448]
    Sequence number: 3474    (relative sequence number)
    [Next sequence number: 4922    (relative sequence number)]
    Acknowledgment number: 1183    (relative ack number)
    Header Length: 32 bytes
    .... 0000 0001 0000 = Flags: 0x010 (ACK)
    Window size value: 409
    [Calculated window size: 409]
    [Window size scaling factor: -1 (unknown)]
    Checksum: 0x78a1 [validation disabled]
    Urgent pointer: 0
    Options: (12 bytes), No-Operation (NOP), No-Operation (NOP), Timestamps
    [SEQ/ACK analysis]
    [Reassembled PDU in frame: 54]
    TCP segment data (1448 bytes)

No.     Time           Source                Destination           Protocol Length Info
     41 3.705059000    10.20.152.255         205.213.114.13        TCP      66     60002→443 [ACK] Seq=1183 Ack=578 Win=18986 Len=0 TSval=1132063339 TSecr=661416251

Frame 41: 66 bytes on wire (528 bits), 66 bytes captured (528 bits) on interface 0
Ethernet II, Src: Apple_b1:35:47 (70:56:81:b1:35:47), Dst: JuniperN_83:9f:f0 (88:e0:f3:83:9f:f0)
Internet Protocol Version 4, Src: 10.20.152.255 (10.20.152.255), Dst: 205.213.114.13 (205.213.114.13)
Transmission Control Protocol, Src Port: 60002 (60002), Dst Port: 443 (443), Seq: 1183, Ack: 578, Len: 0
    Source Port: 60002 (60002)
    Destination Port: 443 (443)
    [Stream index: 2]
    [TCP Segment Len: 0]
    Sequence number: 1183    (relative sequence number)
    Acknowledgment number: 578    (relative ack number)
    Header Length: 32 bytes
    .... 0000 0001 0000 = Flags: 0x010 (ACK)
    Window size value: 18986
    [Calculated window size: 18986]
    [Window size scaling factor: -1 (unknown)]
    Checksum: 0x602d [validation disabled]
    Urgent pointer: 0
    Options: (12 bytes), No-Operation (NOP), No-Operation (NOP), Timestamps
    [SEQ/ACK analysis]

No.     Time           Source                Destination           Protocol Length Info
     42 3.705118000    10.20.152.255         205.213.114.13        TCP      66     60002→443 [ACK] Seq=1183 Ack=3474 Win=18896 Len=0 TSval=1132063339 TSecr=661416251

Frame 42: 66 bytes on wire (528 bits), 66 bytes captured (528 bits) on interface 0
Ethernet II, Src: Apple_b1:35:47 (70:56:81:b1:35:47), Dst: JuniperN_83:9f:f0 (88:e0:f3:83:9f:f0)
Internet Protocol Version 4, Src: 10.20.152.255 (10.20.152.255), Dst: 205.213.114.13 (205.213.114.13)
Transmission Control Protocol, Src Port: 60002 (60002), Dst Port: 443 (443), Seq: 1183, Ack: 3474, Len: 0
    Source Port: 60002 (60002)
    Destination Port: 443 (443)
    [Stream index: 2]
    [TCP Segment Len: 0]
    Sequence number: 1183    (relative sequence number)
    Acknowledgment number: 3474    (relative ack number)
    Header Length: 32 bytes
    .... 0000 0001 0000 = Flags: 0x010 (ACK)
    Window size value: 18896
    [Calculated window size: 18896]
    [Window size scaling factor: -1 (unknown)]
    Checksum: 0x5537 [validation disabled]
    Urgent pointer: 0
    Options: (12 bytes), No-Operation (NOP), No-Operation (NOP), Timestamps
    [SEQ/ACK analysis]

No.     Time           Source                Destination           Protocol Length Info
     43 3.705368000    10.20.152.255         205.213.114.13        TCP      66     60002→443 [ACK] Seq=1183 Ack=4922 Win=19005 Len=0 TSval=1132063339 TSecr=661416251

Frame 43: 66 bytes on wire (528 bits), 66 bytes captured (528 bits) on interface 0
Ethernet II, Src: Apple_b1:35:47 (70:56:81:b1:35:47), Dst: JuniperN_83:9f:f0 (88:e0:f3:83:9f:f0)
Internet Protocol Version 4, Src: 10.20.152.255 (10.20.152.255), Dst: 205.213.114.13 (205.213.114.13)
Transmission Control Protocol, Src Port: 60002 (60002), Dst Port: 443 (443), Seq: 1183, Ack: 4922, Len: 0
    Source Port: 60002 (60002)
    Destination Port: 443 (443)
    [Stream index: 2]
    [TCP Segment Len: 0]
    Sequence number: 1183    (relative sequence number)
    Acknowledgment number: 4922    (relative ack number)
    Header Length: 32 bytes
    .... 0000 0001 0000 = Flags: 0x010 (ACK)
    Window size value: 19005
    [Calculated window size: 19005]
    [Window size scaling factor: -1 (unknown)]
    Checksum: 0x4f22 [validation disabled]
    Urgent pointer: 0
    Options: (12 bytes), No-Operation (NOP), No-Operation (NOP), Timestamps
    [SEQ/ACK analysis]

No.     Time           Source                Destination           Protocol Length Info
     44 3.706561000    205.213.114.13        10.20.152.255         TCP      1514   [TCP segment of a reassembled PDU]

Frame 44: 1514 bytes on wire (12112 bits), 1514 bytes captured (12112 bits) on interface 0
Ethernet II, Src: JuniperN_83:9f:f0 (88:e0:f3:83:9f:f0), Dst: Apple_b1:35:47 (70:56:81:b1:35:47)
Internet Protocol Version 4, Src: 205.213.114.13 (205.213.114.13), Dst: 10.20.152.255 (10.20.152.255)
Transmission Control Protocol, Src Port: 443 (443), Dst Port: 60002 (60002), Seq: 4922, Ack: 1183, Len: 1448
    Source Port: 443 (443)
    Destination Port: 60002 (60002)
    [Stream index: 2]
    [TCP Segment Len: 1448]
    Sequence number: 4922    (relative sequence number)
    [Next sequence number: 6370    (relative sequence number)]
    Acknowledgment number: 1183    (relative ack number)
    Header Length: 32 bytes
    .... 0000 0001 0000 = Flags: 0x010 (ACK)
    Window size value: 409
    [Calculated window size: 409]
    [Window size scaling factor: -1 (unknown)]
    Checksum: 0xa5f9 [validation disabled]
    Urgent pointer: 0
    Options: (12 bytes), No-Operation (NOP), No-Operation (NOP), Timestamps
    [SEQ/ACK analysis]
    [Reassembled PDU in frame: 54]
    TCP segment data (1448 bytes)

No.     Time           Source                Destination           Protocol Length Info
     45 3.706570000    205.213.114.13        10.20.152.255         TCP      1514   [TCP segment of a reassembled PDU]

Frame 45: 1514 bytes on wire (12112 bits), 1514 bytes captured (12112 bits) on interface 0
Ethernet II, Src: JuniperN_83:9f:f0 (88:e0:f3:83:9f:f0), Dst: Apple_b1:35:47 (70:56:81:b1:35:47)
Internet Protocol Version 4, Src: 205.213.114.13 (205.213.114.13), Dst: 10.20.152.255 (10.20.152.255)
Transmission Control Protocol, Src Port: 443 (443), Dst Port: 60002 (60002), Seq: 6370, Ack: 1183, Len: 1448
    Source Port: 443 (443)
    Destination Port: 60002 (60002)
    [Stream index: 2]
    [TCP Segment Len: 1448]
    Sequence number: 6370    (relative sequence number)
    [Next sequence number: 7818    (relative sequence number)]
    Acknowledgment number: 1183    (relative ack number)
    Header Length: 32 bytes
    .... 0000 0001 0000 = Flags: 0x010 (ACK)
    Window size value: 409
    [Calculated window size: 409]
    [Window size scaling factor: -1 (unknown)]
    Checksum: 0xbeb6 [validation disabled]
    Urgent pointer: 0
    Options: (12 bytes), No-Operation (NOP), No-Operation (NOP), Timestamps
    [SEQ/ACK analysis]
    [Reassembled PDU in frame: 54]
    TCP segment data (1448 bytes)

No.     Time           Source                Destination           Protocol Length Info
     46 3.706571000    205.213.114.13        10.20.152.255         TCP      1514   [TCP segment of a reassembled PDU]

Frame 46: 1514 bytes on wire (12112 bits), 1514 bytes captured (12112 bits) on interface 0
Ethernet II, Src: JuniperN_83:9f:f0 (88:e0:f3:83:9f:f0), Dst: Apple_b1:35:47 (70:56:81:b1:35:47)
Internet Protocol Version 4, Src: 205.213.114.13 (205.213.114.13), Dst: 10.20.152.255 (10.20.152.255)
Transmission Control Protocol, Src Port: 443 (443), Dst Port: 60002 (60002), Seq: 7818, Ack: 1183, Len: 1448
    Source Port: 443 (443)
    Destination Port: 60002 (60002)
    [Stream index: 2]
    [TCP Segment Len: 1448]
    Sequence number: 7818    (relative sequence number)
    [Next sequence number: 9266    (relative sequence number)]
